DBN,School Name,NumberofTestTakers,CriticalReadingMean,MathematicsMean,WritingMean
01M292,Henry Street School for International Studies ,Medio,391,425,385
01M448,University Neighborhood High School ,Medio,394,419,387
01M450,East Side Community High School ,Medio,418,431,402
01M458,SATELLITE ACADEMY FORSYTH ST ,Bajo,385,370,378
01M509,CMSP HIGH SCHOOL ,Bajo,,,
01M515,Lower East Side Preparatory High School ,Alto,314,532,314
01M539,"New Explorations into Sci, Tech and Math HS ",Medio,568,583,568
01M650,CASCADES HIGH SCHOOL ,Medio,411,401,401
01M696,BARD HIGH SCHOOL EARLY COLLEGE ,Alto,630,608,630
02M047,AMERICAN SIGN LANG ENG DUAL ,Bajo,405,415,385
02M288,FOOD AND FNANCE HIGH SCHOOL ,Medio,422,412,407
02M294,HIGH SCHOOL FOR HIST AND COMM ,Medio,382,364,366
02M296,High School of Hospitality Management ,Medio,397,415,391
02M298,PACE HIGH SCHOOL ,Medio,424,448,423
02M300,Urban Assembly School of Design and Construction ,Medio,405,446,415
02M303,The Facing History School ,Medio,381,373,377
02M305,Urban Assembly Academy of Government and Law ,Medio,411,406,411
02M308,LOWER MANHATTAN ARTS ACADEMY ,Medio,409,381,412
02M313,The James Baldwin School ,Medio,421,419,394
02M316,Urban Assembly School of Business for Young Women ,Medio,401,409,391
02M374,GRAMERCY ARTS HIGH SCHOOL ,Medio,395,376,386
02M376,NYC iSchool ,Bajo,,,
02M400,HIGH SCHOOL ENVRNMNTL STUDIES ,Alto,465,480,448
02M407,Institute for Collaborative Education ,Medio,484,478,472
02M408,Professional Performng Arts School ,Medio,495,465,499
02M411,Baruch College Campus High School ,Medio,523,583,528
02M412,New York City Laboratory School Collab Studies ,Alto,561,597,567
02M413,SCHOOL OF THE FUTURE ,Medio,475,488,466
02M414,NEW YORK CITY MUSEUM SCHOOL ,Medio,454,448,435
02M416,ELEANOR ROOSEVELT HIGH SCHOOL ,Alto,555,596,567
02M418,Millennium High School ,Alto,512,554,523
02M419,LANDMARK SCHOOL ,Medio,369,370,359
02M420,HIGH SCHOOL HLTH PROF HUMAN ,Alto,446,458,440
02M425,HIGH SCHOOL LEADERSHIP PUB SVC ,Medio,419,429,406
02M429,LEGACY SCH INTEGRATED STUDIES ,Medio,379,356,354
02M439,MANHATTAN VILLAGE ACADEMY ,Medio,465,479,472
02M440,Bayard Rustin High School Humanities ,Alto,387,394,379
02M445,Seward Park High School ,Bajo,,,
02M449,VANGUARD HIGH SCHOOL ,Medio,367,395,373
02M459,MANHATTAN INTERNATIONAL HIGH SCHOOL ,Medio,418,463,415
02M460,WASHINGTON IRVING HIGH SCHOOL ,Alto,381,385,368
02M473,YABC at Washington Irving High School ,Bajo,,,
02M475,STUYVESANT HIGH SCHOOL ,Alto,674,735,678
02M489,HS of Economics And Finance ,Alto,451,503,453
02M500,UNITY HIGH SCHOOL ,Medio,371,369,368
02M519,TALENT UNLIMITED HIGH SCHOOL ,Alto,465,454,461
02M520,MURRY BERGTRAUM HIGH SCHOOL ,Alto,411,439,396
02M529,Jacqueline Kennedy Onassis High School ,Medio,420,424,398
02M531,NEW YORK CITY PUB SCH REP COMP ,Medio,415,405,397
02M535,Park West High School ,Bajo,,,
02M542,MANHATTAN BRIDGE HIGH SCHOOL ,Medio,345,380,325
02M543,NEW DESIGN HIGH SCHOOL ,Medio,390,385,387
02M544,INDEPENDENCE HIGH SCHOOL ,Bajo,404,419,395
02M545,Dual Language and Asian Studies High School ,Medio,416,612,419
02M550,Liberty High School Academy for Newcomers ,Medio,343,465,362
02M551,New York Harbor High School ,Medio,372,369,368
02M560,City as School ,Medio,468,441,434
02M565,URBAN ACADEMY ,Medio,513,460,502
02M570,Satellite Academy High School ,Bajo,400,336,376
02M575,Manhattan Comprehensive Night Day High School ,Alto,355,475,339
02M580,Richard R Green High School of Teaching ,Medio,425,429,419
02M586,HARVEY MILK SCHOOL ,Bajo,429,382,416
02M600,HIGH SCHOOL FASHION INDUSTRIES ,Alto,419,420,413
02M605,HUMANITIES PREPARATORY ACADEMY ,Medio,433,405,417
02M615,Chelsea Career and Technical Education High School ,Medio,393,412,376
02M620,NORMAN THOMAS HIGH SCHOOL ,Alto,378,387,370
02M625,HS of Graphic Commnctn And Art ,Alto,370,378,360
02M630,HIGH SCHOOL OF ART AND DESIGN ,Alto,427,423,418
02M655,LIFE SCIENCES SECONDARY SCHOOL ,Medio,399,389,383
02M690,SCHOOL FOR THE PHYSICAL CITY ,Bajo,382,404,359
03M283,MANHATTAN THEATRE LAB HIGH SCHOOL ,Bajo,406,378,391
03M299,"High School For Arts, Imagination And Inquiry ",Medio,364,378,357
03M307,Urban Assembly School For Media Studies ,Medio,374,363,377
03M404,INNOVATION DIPLOMA PLUS HIGH SCHOOL ,Bajo,,,
03M415,WADLEIGH SECONDARY SCHOOL ,Medio,376,373,371
03M470,LOUIS D BRANDEIS HIGH SCHOOL ,Alto,357,357,345
03M479,BEACON SCHOOL ,Alto,573,563,575
03M485,LAGUARDIA HIGH SCH MUSIC ART ,Alto,558,555,567
03M494,Martin Luther King Jr HS Arts and Technology ,Medio,407,425,397
03M505,Edward A. Reynolds West Side High School ,Bajo,410,407,388
03M541,MANHATTAN/HUNTER COLL HS SCI ,Medio,481,525,469
03M860,FREDERICK DOUGLAS ACADEMY II ,Medio,414,410,406
04M409,COALITION SCH SOCIAL CHANGE ,Medio,390,372,383
04M435,Manhattan Center for Science and Math ,Alto,485,531,475
04M495,PARK EAST HIGH SCHOOL ,Medio,360,374,362
04M555,CENTRAL PARK SECONDARY SCHOOL ,Medio,362,378,356
04M610,YOUNG WOMEN LEADERSHIP SCHOOL ,Medio,451,445,470
04M610,Young Women's Leadership School of Astoria ,Bajo,,,
04M635,Academy of Environment Science Secondary School ,Medio,380,385,354
04M680,HERITAGE SCHOOL ,Medio,369,385,361
04M695,URBAN PEACE ACADEMY ,Bajo,366,382,362
05M285,HARLEM RENAISSANCE HIGH SCHOOL ,Bajo,402,394,367
05M304,MOTT HALL HIGH SCHOOL ,Medio,424,421,410
05M367,Academy for Social Action ,Bajo,,,
05M369,URBAN ASSEMBLY SCHOOL FOR THE PERFORMIN ,Medio,349,370,363
05M469,CHOIR ACADEMY OF HARLEM ,Bajo,420,369,401
05M499,FREDERICK DOUGLASS ACADEMY ,Alto,465,481,466
05M670,THURGOOD MARSHALL ACADEMY ,Medio,423,434,404
05M685,Bread & Rose Intergrated Arts High School ,Medio,364,378,359
05M692,High School For Math Science Engineering City Coll ,Alto,592,627,575
06M293,MS 293 City College Academy of the Arts ,Bajo,,,
06M346,Community Health Academy Heights ,Bajo,,,
06M348,MS 348 Washington Heights Expeditionary Learning S ,Bajo,,,
06M457,YABC AT G. WASHINGTON EDUCATIONAL CAMPUS ,Bajo,,,
06M462,HIGH SCHOOL FOR INTL BUS/FIN ,Medio,383,384,379
06M463,HS for Media and Communications-George Washingto ,Medio,366,376,353
06M467,High School for Law and Public Service ,Alto,388,388,378
06M468,HIGH SCHOOL FOR HLTH CARER/SER ,Bajo,385,417,373
06M540,A Philip Randolph Campus High School ,Alto,436,451,421
06M552,GREGORIO LUPERON PREP SCHOOL ,Medio,342,384,333
07X221,SOUTH BRONX PREPARATORY ,Medio,399,393,382
07X321,CROTANA ACADEMY HIGH SCHOOL ,Bajo,,,
07X334,INTERNATIONAL COMMUNITY HIGH SCHOOL ,Medio,322,335,327
07X379,Jill Chaifetz Transfer High School ,Bajo,,,
07X381,BRONX HAVEN HIGH SCHOOL ,Bajo,335,342,372
07X427,Community High School Social Justice ,Medio,372,351,359
07X473,Mott Haven Village Preparatory High School ,Medio,345,352,349
07X495,UNIVERSITY HEIGHTS HIGH SCHOOL ,Medio,401,388,396
07X500,HOSTOS-LINCOLN ACADEMY SCIENCE ,Medio,460,455,457
07X520,FOREIGN LANGUAGE ACADEMY ,Medio,418,429,415
07X527,Bronx Leadership Academy II High School ,Medio,377,381,379
07X547,NEW EXPLORERS HIGH SCHOOL ,Medio,382,376,376
07X548,Urban Assembly School for Careers in Sports ,Medio,381,423,384
07X551,Bronx Academy of Letters ,Medio,416,406,435
07X600,ALFRED E SMITH HIGH SCHOOL ,Medio,367,372,354
07X655,Samuel Gompers Vocational Technical High School ,Alto,370,385,354
07X670,Health Opportunities High School ,Medio,400,391,387
08X282,YOUNG WOMEN'S LEADERSHIP SCH BRONX CMP ,Medio,395,407,388
08X293,Renaissance High School Music Theater T ,Medio,389,375,375
08X295,Gateway School for Environmental Research & Tech ,Medio,377,367,368
08X305,Pablo Neruda Academy Architecture & World Studies ,Medio,359,358,338
08X312,MILLENNIUM ART ACADEMY ,Medio,380,389,371
08X332,HOLCOMBE L. RUCKER SCHOOL OF COMMUNITY ,Medio,374,362,366
08X377,BRONX COMMUNITY HIGH SCHOOL (X377) ,Bajo,416,393,414
08X405,HERBERT H LEHMAN HIGH SCHOOL ,Alto,414,433,397
08X408,YABC AT HERBERT H. LEHMAN HIGH SCHOOL ,Bajo,358,343,385
08X450,ADLAI E STEVENSON HIGH SCHOOL ,Bajo,,,
08X452,The Bronx Guild High School ,Medio,381,361,352
08X507,YABC AT ADLAI STEVENSON HIGH SCHOOL ,Bajo,,,
08X519,Felisa Rincon de Gautier Inst for Law & Pub Policy ,Medio,373,376,367
08X530,BANANA KELLY HIGH SCHOOL ,Medio,377,382,368
08X540,HIGH SCHOOL CMTY RESEARCH LRN ,Bajo,356,376,368
08X560,BRONX ACADEMY HIGH SCHOOL ,Bajo,373,354,364
08X650,Jane Addams Vocational High School ,Alto,370,377,363
09X227,Bronx Expeditionary Learning High School ,Medio,371,358,343
09X231,Eagle Academy for Young Men ,Medio,391,399,386
09X239,Urban Assembly Academy History & Citizenship ,Bajo,359,380,371
09X241,Urban Assembly School for Applied Math Science ,Bajo,,,
09X250,EXIMIUS COLLEGE PREP ACADEMY ,Medio,401,383,387
09X252,MOTT HALL BRONX HIGH SCHOOL ,Medio,395,398,399
09X260,Bronx Center for Science and Mathematics ,Medio,447,495,454
09X263,VALIDUS PREPARATORY ACADEMY ,Medio,359,347,356
09X276,LEADERSHIP INSTITUTE ,Bajo,362,380,358
09X297,MORRIS ACADEMY FOR COLLABORATIVE STUDIE ,Bajo,388,352,378
09X329,DREAMYARD PREPARATORY SCHOOL ,Medio,394,404,389
09X365,ACADEMY FOR LANGUAGE AND TECHNOLOGY ,Bajo,,,
09X403,Bronx International High School ,Medio,335,335,340
09X404,HIGH SCHOOL FOR EXCELLENCE ,Medio,366,373,371
09X412,BRONX HIGH SCHOOL OF BUSINESS ,Medio,369,397,366
09X413,HIGH SCHOOL MEDICAL SCIENCES ,Medio,423,450,435
09X414,Jonathan Levin HS for Media and Communications ,Medio,347,353,351
09X505,BRONX SCH LAW GOVMT & JUSTICE ,Medio,413,390,420
09X517,Frederick Douglass Academy III Secondary School ,Medio,399,414,406
09X525,Bronx Leadership Academy High School ,Alto,402,397,396
09X543,HIGH SCHOOL VIOLIN AND DANCE ,Bajo,332,379,337
10X141,RIVERDALE KINGSBRIDGE ACADEMY ,Alto,475,479,470
10X213,BRONX ENGINEERING & TECH ACADEMY ,Medio,374,402,364
10X225,Theatre Arts Production Company School ,Medio,382,375,363
10X237,"Marie Curie HS for Nur, Med and Allied Health Prof ",Medio,373,358,366
10X243,WEST BRONX ACADEMY FOR FUTURE ,Medio,365,382,375
10X268,Kingsbridge International High School ,Medio,313,316,296
10X284,BRONX SCHOOL OF LAW & FINANCE ,Medio,404,397,383
10X319,Providing Urban Learners Success in Education HS ,Bajo,349,346,364
10X342,International School of Liberal Arts ,Medio,333,336,285
10X368,Information Technology Academy ,Medio,418,411,398
10X374,Knowledge & Power Prep Acad International HS ,Bajo,,,
10X430,WALTON HIGH SCHOOL ,Bajo,,,
10X430,YABC AT WALTON HIGH SCHOOL ,Bajo,,,
10X433,HIGH SCHOOL TEACHING PROFESSNS ,Medio,386,385,381
10X434,Belmont Preparatory High School ,Medio,358,370,346
10X437,Fordham High School for the Arts ,Medio,377,375,375
10X438,Fordham Leadership Academy for Business Technolog ,Medio,375,385,373
10X439,Bronx High School of Law and Community Service ,Medio,389,400,382
10X440,DeWitt Clinton High School ,Alto,425,440,417
10X442,BRONX HIGH SCHOOL OF MUSIC ,Medio,421,432,439
10X445,BRONX HIGH SCHOOL OF SCIENCE ,Alto,632,685,643
10X475,JOHN F KENNEDY HIGH SCHOOL ,Medio,364,375,358
10X477,MARBLE HILL SCH INTL STUDIES ,Medio,406,429,403
10X478,YABC AT JOHN F. KENNEDY HIGH SCHOOL ,Bajo,389,383,364
10X546,BRONX THEATER HIGH SCHOOL ,Medio,406,389,388
10X549,DISCOVERY HIGH SCHOOL ,Medio,340,340,351
10X660,Grace Dodge Vocational High School ,Medio,380,385,369
10X667,YABC AT GRACE DODGE HIGH SCHOOL ,Bajo,367,378,358
10X696,HS of American Studies at Lehman College ,Medio,635,630,619
11X249,Bronx Health School High School 11x249 ,Medio,363,366,364
11X253,High School For Writing & Communication Arts ,Medio,393,363,387
11X265,BRONX LAB SCHOOL ,Medio,356,370,355
11X270,Academy for Scholarship and Entrepreneurship ,Medio,373,376,362
11X275,High School of Computers and Technology ,Medio,399,402,373
11X288,Columbus Institute for Math and Science ,Medio,432,464,424
11X290,BRONX ACAD OF HEALTH CAREERS ,Medio,369,363,380
11X299,ASTOR COLLEGIATE ACADEMY ,Medio,404,400,388
11X415,Christopher Columbus High School ,Alto,354,373,350
11X418,Bronx High School for the Visual Arts ,Medio,419,403,392
11X425,EVANDER CHILDS HIGH SCHOOL ,Bajo,344,306,350
11X455,HARRY S TRUMAN HIGH SCHOOL ,Alto,380,384,379
11X456,YABC AT HARRY S. TRUMAN HIGH SCHOOL ,Bajo,,,
11X513,NEW WORLD HIGH SCHOOL ,Medio,331,384,341
11X514,Bronxwood Peparatory Academy ,Bajo,359,389,350
11X541,GLOBAL ENTERPRISE HIGH SCHOOL ,Medio,372,359,373
11X542,PELHAM PREPARATORY ACADEMY ,Medio,427,416,424
11X544,High School for the Contemporary Arts ,Medio,359,340,338
11X545,BRONX AEROSPACE HIGH SCHOOL ,Medio,393,395,389
12X245,NEW DAY ACADEMY ,Bajo,368,349,358
12X248,METROPOLITAN HIGH SCHOOL ,Medio,340,361,335
12X251,EXPLORATIONS ACADEMY ,Medio,364,364,344
12X262,Bronx High School Performance & Stage ,Medio,383,360,387
12X267,Bronx Latin School ,Bajo,,,
12X271,EAST BRONX ACADEMY FOR THE FUTURE ,Bajo,415,390,397
12X278,PEACE & DIVERSITY ACAD HIGH SCHOOL ,Bajo,408,400,401
12X400,Morris High School ,Bajo,369,374,360
12X428,YABC at Monroe Academy ,Bajo,386,345,388
12X446,Schomburg Satellite Academy ,Bajo,354,366,364
12X480,BRONX REGIONAL HIGH SCHOOL ,Bajo,359,366,359
12X550,HIGH SCHOOL OF WORLD CULTURES ,Medio,291,333,291
12X680,Bronx Coalition Community High School ,Medio,372,366,360
12X682,Fannie Lou Hamer Freedom High School ,Medio,333,326,330
12X684,WINGS ACADEMY ,Medio,386,397,383
12X690,MONROE CAMPUS ,Medio,355,369,366
12X692,MONROE ACAD VISUAL ARTS DESGN ,Medio,346,341,356
13K265,Dr Susan S McKinney Secondary School of the Arts ,Medio,387,369,369
13K336,Urban Assembly Academy of Business & Community D ,Bajo,,,
13K350,Urban Assembly School of Music and Art ,Medio,394,371,371
13K412,BROOKLYN COMMUNITY HIGH SCHOOL ,Medio,393,356,377
13K419,Science Skills Center High School ,Alto,419,421,409
13K430,BROOKLYN TECHNICAL HIGH SCHOOL ,Alto,588,652,581
13K483,Urban Assembly School of Law and Justice ,Alto,414,415,412
13K499,Acorn Association of Community Organization Return ,Alto,367,361,360
13K509,FREEDOM ACADEMY ,Medio,416,386,408
13K553,BROOKLYN ACADEMY HIGH SCHOOL ,Bajo,403,384,377
13K575,Bedford Stuyvesant Street Academy High School ,Bajo,366,380,362
13K595,BEDFORD ACADEMY HIGH SCHOOL ,Medio,453,469,441
13K605,George Westinghouse Vocational Technical HS ,Medio,390,360,373
13K616,Brooklyn High Sch for Leadership Community Svc ,Bajo,323,281,310
13K670,BENJAMIN BANNEKER ACADEMY ,Alto,476,477,445
14K071,JHS 071 JUAN MOREL CAMPOS ,Medio,362,369,349
14K322,FOUNDATIONS ACADEMY ,Bajo,373,377,359
14K404,ACADEMY FOR YOUNG WRITERS ,Medio,377,366,365
14K449,BROOKLYN LATIN SCHOOL ,Medio,536,534,527
14K454,GREEN SCHOOL: AN ACADEMY FOR ENVIRONMEN ,Medio,381,381,366
14K474,Progress High School For Professional Careers ,Alto,365,375,373
14K477,School for Legal Studies ,Medio,385,390,384
14K478,"Enterprise, Business and Technology High School ",Medio,360,390,354
14K488,BROOKLYN PREP HIGH SCHOOL ,Medio,397,377,387
14K558,Williamsburg High School for Architecture & Design ,Medio,399,393,367
14K561,WILLIAMSBURG PREP ,Medio,375,386,369
14K586,LYONS COMMUNITY SCHOOL ,Bajo,,,
14K610,AUTOMOTIVE HIGH SCHOOL ,Medio,353,359,340
14K632,The Frances Perkins Academy ,Bajo,,,
14K640,HARRY VAN ARSDALE HIGH SCHOOL ,Bajo,,,
14K685,El Puente Academy for Peace and Justice ,Bajo,375,386,394
14K923,YABC at Automative High School ,Bajo,,,
15K429,BROOKLYN SCHOOL GLOBAL STUDIES ,Medio,374,365,374
15K448,Brooklyn Secondary Sch for Collaborative Studies ,Medio,385,380,375
15K462,"Secondary School for Law, Journalism and Research ",Medio,406,409,393
15K463,SECONDARY SCHOOL JOURNALISM ,Medio,393,372,370
15K464,SECONDARY SCHOOL FOR RESEARCH ,Medio,373,395,368
15K497,SCHOOL INTERNATIONAL STUDIES ,Medio,402,414,382
15K519,COBBE HILL SCHOOL AMERICAN STD ,Medio,365,358,360
15K520,PACIFIC HIGH SCHOOL ,Bajo,356,352,343
15K529,WEST BROOKLYN COMMUNITY HIGH SCHOOL ,Bajo,363,382,381
15K530,METROPOLITAN CORPORATE ACADEMY ,Bajo,370,348,348
15K656,Brooklyn High School of the Arts ,Medio,416,417,425
15K698,South Brooklyn Community High School ,Bajo,387,371,368
16K393,Frederick Douglass Academy IV Seconday School ,Bajo,429,421,424
16K455,BOYS AND GIRLS HIGH SCHOOL ,Alto,369,367,366
16K498,Acorn High School for Social Justice ,Medio,367,364,364
16K594,Gotham Professional Arts Academy ,Bajo,,,
17K382,ACADEMY FOR COLLEGE PREPARATION CAREER ,Medio,401,412,404
17K408,ACADEMY OF HOSPITALITY AND TOURISM ,Medio,400,405,399
17K440,Prospect Heights High School ,Bajo,388,373,374
17K467,YABC AT ERASMUS CAMPUS ,Bajo,,,
17K469,Campus School of the Humanities at Erasmus Hall ,Bajo,,,
17K470,George Wood Wingate High School ,Bajo,,,
17K489,W E B DUBOIS HIGH SCHOOL ,Bajo,381,344,360
17K524,International High School @Prospect Hgt ,Medio,302,339,325
17K528,HIGH SCHOOL FOR GLOBAL CITIZENSHIP ,Medio,382,387,381
17K531,SCHOOL FOR HUMAN RIGHTS ,Bajo,357,391,343
17K533,SCHOOL FOR DEMOCRACY AND LEADERSHIP ,Bajo,358,378,372
17K537,HS FOR YOUTH CMMTY DEVLPMT AT ERASMUS ,Medio,361,376,365
17K539,HS FOR SERVICE AND LEARNING AT ERASMUS ,Medio,371,366,381
17K543,SCIENCE TECH RESEARCH HS AT ERASMUS ,Medio,445,425,415
17K544,INTERNATIONAL ARTS BUSINESS HS ,Medio,392,390,381
17K546,HIGH SCHOOL FOR PUBLIC SERVICE ,Medio,412,427,420
17K547,Brooklyn High School for Science and the Environ ,Medio,391,396,388
17K548,BROOKLYN HS MUSIC AND THEATER ,Medio,385,351,381
17K568,BROWNSVILLE ACADEMY HIGH SCHOOL ,Bajo,356,358,366
17K590,Medgar Evers College Preparatory High School ,Alto,459,482,452
17K600,Clara Barton High School ,Alto,419,413,411
17K625,Paul Robeson High School ,Alto,355,358,348
18K415,SAMUEL J TILDEN HIGH SCHOOL ,Medio,328,341,338
18K500,CANARSIE HIGH SCHOOL ,Alto,372,373,364
18K501,YABC AT CANARSIE HIGH SCHOOL ,Bajo,,,
18K515,SOUTH SHORE HIGH SCHOOL ,Bajo,365,352,336
18K563,IT TAKES A VILLAGE ACADEMY ,Bajo,,,
25Q540,QUEENS ACADEMY ,Bajo,400,395,391
18K566,BROOKLYN GENERATION SCHOOL ,Bajo,,,
18K567,BROOKLYN THEATRE ARTS HIGH SCHOOL ,Bajo,,,
18K569,Kurt Hahn Expeditionary Learning School ,Bajo,,,
18K576,VICTORY COLLEGIATE HIGH SCHOOL ,Bajo,,,
18K578,BROOKLYN BRIDGE ACADEMY OF S SHORE ED CO ,Bajo,389,358,369
18K589,ARTS & MEDIA PREPARATORY ACADEMY ,Bajo,,,
18K617,High School for Innovation in Advertising and Media ,Bajo,,,
18K629,Cultural Academy for the Arts and Sciences ,Bajo,,,
18K633,High School for Medical Professions ,Bajo,,,
18K635,OLYMPUS ACADEMY ,Bajo,361,365,365
18K642,Urban Action Academy ,Bajo,,,
18K673,East Brooklyn Community High School ,Bajo,,,
19K409,EAST NEW YORK FAMILY ACADEMY ,Medio,435,428,414
19K420,FRANKLIN K LANE HIGH SCHOOL ,Alto,353,379,341
19K431,"YOUNG ADULT BOROUGH CTR, THOMAS JEFFERS ",Bajo,,,
19K435,THOMAS JEFFERSON HIGH SCHOOL ,Bajo,,,
19K502,FDNY HIGH SCH DOR FIRE & LIFE ,Bajo,376,375,363
19K504,HIGH SCHOOL FOR CIVIL RIGHTS ,Bajo,369,372,380
19K507,PERFORMING ARTS & TECH HIGH SCHOOL ,Medio,371,363,356
19K510,World Acad for Total Community Health ,Bajo,370,371,376
19K583,Multicultural High School ,Bajo,,,
19K615,East New York High School of Transit Technology ,Alto,413,419,403
19K618,Academy of Innovative Technology High School ,Bajo,,,
19K639,Brooklyn Lab School ,Bajo,,,
19K659,CYPRESS HILLS COLLEGIATE PREPARATORY SCH ,Medio,398,402,378
19K660,William H Maxwell Voc High School ,Medio,355,367,355
19K683,SCHOOL FOR CLASSICS ,Bajo,,,
20K445,NEW UTRECHT HIGH SCHOOL ,Alto,409,471,407
20K485,High School of Telecommunication Arts ,Alto,450,471,440
20K490,FORT HAMILTON HIGH SCHOOL ,Alto,416,486,409
20K505,Franklin D Roosevelt High School ,Alto,387,492,377
20K658,YABC at Franklin D. Roosevelt High School ,Medio,363,443,369
21K337,International High School at LaFayette ,Medio,355,395,355
21K344,Rachel Carson High School for Coastal Studies ,Medio,422,459,418
21K348,HIGH SCHOOL OF SPORTS MANAGEMENT ,Medio,370,427,381
21K400,LAFAYETTE HIGH SCHOOL ,Medio,327,367,315
21K410,ABRAHAM LINCOLN HIGH SCHOOL ,Alto,386,429,385
21K412/21K411,YABC AT ABRAHAM LINCOLN HIGH SCHOOL ,Bajo,,,
21K525,EDWARD R MURROW HIGH SCHOOL ,Alto,472,503,468
21K540,JOHN DEWEY HIGH SCHOOL ,Alto,414,465,396
21K559,LIFE ACADEMY HIGH SCHOOL FOR FILM AND MUS ,Bajo,,,
21K572,Expeditionary Learning Sch for Community Leaders ,Bajo,,,
21K620,William E. Grady Vocational Technical High School ,Medio,385,393,361
21K690,BROOKLYN STUDIO SECONDARY SCH ,Medio,426,419,418
21K728,Liberation Diploma Plus High School ,Bajo,402,351,380
22K405,Midwood High School at Brooklyn College ,Alto,493,543,491
22K425,JAMES MADISON HIGH SCHOOL ,Alto,449,478,445
22K495,SHEEPSHEAD BAY HIGH SCHOOL ,Alto,380,416,380
22K535,LEON M GOLDSTEIN HIGH SCHOOL ,Alto,543,578,559
22K555,Brooklyn College Academy High School ,Alto,459,460,446
23K493,BROOKLYN COLLEGIATE ,Medio,394,372,375
23K514,Frederick Douglass Academy VII High School ,Medio,416,396,414
23K643,Brooklyn Democracy Academy ,Bajo,347,371,323
23K645,EBC High School for Public Service - East New York ,Bajo,376,358,368
23K646,ASPIRATIONS DIPLOMA PLUS HIGH SCHOOL ,Medio,349,329,341
23K647,METROPOLITAN DIPLOMA PLUS HIGH SCHOOL ,Bajo,385,378,391
23K697,TEACHERS PREPARATORY SCHOOL ,Medio,396,389,389
24Q264,ACADEMY OF FINANCE AND ENTERPRISE ,Medio,407,432,417
24Q267,High School of Applied Communication ,Medio,411,420,407
24Q293,Civic Leadership Academy ,Bajo,,,
24Q296,Pan American International High School ,Bajo,,,
24Q299,BARD HIGH SCHOOL EARLY COLLEGE II ,Medio,545,548,541
24Q455,NEWTOWN HIGH SCHOOL ,Alto,379,427,372
24Q485,GROVER CLEVELAND HIGH SCHOOL ,Alto,398,431,391
24Q520,MIDDLE COLLEGE HIGH SCHOOL ,Medio,386,402,373
24Q530,INTERNATL HS@LA GUARDIA COMM C ,Medio,355,428,359
24Q550,HIGH SCHOOL FOR ARTS/BUSINESS ,Alto,363,372,363
24Q560,ROBERT F WAGNER JR SECONDARY ,Medio,420,440,421
24Q600,Queens Vocational & Tech High School ,Alto,415,428,401
24Q610,Aviation Career & Technical Education High School ,Alto,444,494,427
24Q744,VOYAGES PREPARATORY HIGH SCHOOL ,Bajo,416,413,364
25Q252,Queens School of Inquiry ,Bajo,,,
25Q263,FLUSHING INTERNATIONAL HIGH SCHOOL ,Medio,325,415,311
25Q281,EAST WEST SCHOOL OF INTERNATIONAL STUDIE ,Medio,438,485,442
25Q285,WORLD JOURNALISM PREPARATORY SCHOOL ,Medio,429,425,421
25Q425,JOHN BOWNE HIGH SCHOOL ,Alto,391,423,389
25Q460,FLUSHING HIGH SCHOOL ,Alto,372,398,366
25Q467,YABC AT FLUSHING HIGH SCHOOL ,Bajo,,,
25Q525,Townsend Harris High School at Queens College ,Alto,637,644,642
25Q670,Robert F Kennedy Community High School ,Medio,449,471,462
25Q792,North Queens Community High School ,Bajo,434,422,422
26Q415,BENJAMIN CARDOZO HIGH SCHOOL ,Alto,486,551,492
26Q430,FRANCIS LEWIS HIGH SCHOOL ,Alto,457,530,454
26Q435,MARTIN VAN BUREN HIGH SCHOOL ,Alto,402,411,398
26Q495,BAYSIDE HIGH SCHOOL ,Alto,472,531,467
26Q566,Queens High School-Teaching Liberal Arts Sciences ,Alto,438,455,433
27Q260,FREDERICK DOUGLASS ACADEMY VI ,Medio,393,390,387
27Q262,CHANNEL VIEW SCHOOL FOR RESEARCH ,Medio,455,423,420
27Q302,"Queens High School for Information, Research, and Te ",Bajo,,,
27Q308,Robert H. Goddard High School for Communication Art ,Bajo,,,
27Q309,ACADEMY OF MEDICAL TECHNOLOGY ,Bajo,,,
27Q323,Region Five Scholars' Academy ,Bajo,,,
27Q400,AUGUST MARTIN HIGH SCHOOL ,Alto,377,372,362
27Q410,BEACH CHANNEL HIGH SCHOOL ,Alto,393,390,380
27Q465,FAR ROCKAWAY HIGH SCHOOL ,Medio,350,369,360
27Q475,RICHMOND HILL HIGH SCHOOL ,Alto,380,401,380
27Q480,JOHN ADAMS HIGH SCHOOL ,Alto,399,424,404
27Q487/27Q481,YABC AT JOHN ADAMS HIGH SCHOOL ,Bajo,,,
27Q650,"HS for Construction Trades, Engineering and Arch ",Medio,421,464,424
28Q310,Queens Collegiate: A College Board School ,Bajo,,,
28Q338,SATELLITE ACADEMY ,Bajo,346,351,338
28Q440,FOREST HILLS HIGH SCHOOL ,Alto,468,491,462
28Q470,JAMAICA HIGH SCHOOL ,Alto,393,400,391
28Q505,HILLCREST HIGH SCHOOL ,Alto,385,400,385
28Q620,Thomas Edison Vocational-Technical High School ,Alto,455,490,439
28Q680,Queens Gateway to Health Sciences Secondary Schoo ,Medio,525,532,515
28Q687,QUEENS HS FOR SCIENCE YORK COL ,Medio,613,650,612
28Q690,High School For Law Enforcement And Public Safety ,Medio,408,429,412
28Q896,Young Women's Leadership High School ,Bajo,,,
29Q248,QUEENS PREPARATORY ACADEMY ,Medio,372,388,381
29Q259,PATHWAYS COLLEGE PREPARATORY SCHOOL ,Medio,406,415,394
29Q265,EXCELSIOR PREPARATORY HIGH SCHOOL ,Medio,394,358,388
29Q272,GEORGE WASHINGTON CARVER HS ,Medio,425,435,418
29Q283,PREPARATORY ACADEMY FOR WRITERS ,Bajo,413,402,388
29Q420,Springfield Gardens High School ,Bajo,429,402,403
29Q492,MATH SCIENCE RESEARCH TECH MAG ,Medio,405,430,405
29Q494,LAW GOVERNMENT SERVICE MAGNET ,Medio,406,412,391
29Q496,BUSINESS COMPUTER APPLICATION ,Medio,388,389,380
29Q498,Humanities and Arts Magnet High School ,Medio,383,371,370
30Q301,Academy for Careers in Television and Film ,Bajo,,,
30Q445,WILLIAM C BRYANT HIGH SCHOOL ,Alto,405,456,408
30Q450,LONG ISLAND CITY HIGH SCHOOL ,Alto,418,434,408
30Q501,Frank Sinatra School of the Arts ,Alto,506,495,499
30Q502,INFORMATION TECHNOLOGY HIGH SCHOOL ,Alto,440,452,424
30Q555,NEWCOMERS HIGH SCHOOL ,Alto,343,447,346
30Q575,ACADEMY OF AMERICAN STUDIES ,Alto,502,505,515
30Q580,BACCALAUREATE SCH GLOBAL EDUC ,Medio,560,587,570
31R064,Gaynor McCown Expeditionary Learning School ,Bajo,,,
31R080,MICHAEL J PETRIDES SCHOOL ,Medio,508,523,502
31R440,NEW DORP HIGH SCHOOL ,Alto,431,446,434
31R445,PORT RICHMOND HIGH SCHOOL ,Alto,437,442,425
31R450,CURTIS HIGH SCHOOL ,Alto,439,441,430
31R455,TOTTENVILLE HIGH SCHOOL ,Alto,459,482,467
31R460,SUSAN E WAGNER HIGH SCHOOL ,Alto,463,482,457
31R470,CONCORD HIGH SCHOOL ,Bajo,474,431,397
31R600,RALPH MCKEE VOC-TECH HIGH SCH ,Medio,411,429,386
31R605,STATEN ISLAND TECHNICAL HIGH SCHOOL ,Alto,638,673,617
32K403,ACADEMY OF ENVIRONMENTAL LEADERSHIP ,Medio,382,369,374
32K480,Bushwick High School ,Bajo,,,
32K545,EBC High School for Public Service - Bushwick ,Medio,389,390,376
32K549,BUSHWICK HS FOR SOCIAL JUSTICE ,Medio,363,364,358
32K552,Academy of Urban Planning ,Medio,355,361,353
